empty_date,empty_desc,announcement_date,announcement_desc,event_date,event_desc
23/10/2020,Scottish Government publish the five-level Strategic Framework,29/10/2020,Scottish Government confirms local authority levels according to five-level Strategic Framework,02/11/2020,Scotland: five-level Strategic Framework comes into force (schools remain open)
,,02/11/2020,First Minister Mark Drakeford announces a new set of national measures to replace the firebreak after 9 November,09/11/2020,Wales: end of firebreak lockdown and start of new set of national measures
,,,,12/11/2020,NI: restrictions extended for one week
,,17/11/2020,Scottish Government announces updated COVID-19 protection levels and travel regulations (11 local authorities move into the highest protection level),20/11/2020,Scotland: 11 local authorities move into the highest protection level
,,23/11/2020,Government announces that gyms and non-essential shops will open after English lockdown ends,02/12/2020,England: easing of restrictions (gyms and non-essential shops reopen)
23/11/2020,PM due to lay out details of  restrictions post-lockdown in England,23/11/2020,PM confirms end of lockdown in England on 2 December and return to three-tier system in a new form,02/12/2020,"England: end of second lockdown, return to three-tier system"
24/11/2020,"PM announces UK-wide 5-day easing of restrictions over Christmas (three households, 23 to 27 December)",23/12/2020,Govt announces UK-wide easing of restrictions on 25 December only to form a Christmas bubble (except for Tier 4 in England),25/12/2020,UK-wide easing of restrictions only on Christmas Day (except for Tier 4 in England)
,,30/11/2020,First Minister Mark Drakeford announces new targeted restrictions in hospitality and leisure from 4 December,04/12/2020,Wales: new targeted restrictions in hospitality and leisure come into force
,,03/12/2020,First Minister Mark Drakeford announces stricter coronavirus travel restrictions between Wales and the rest of UK,04/12/2020,Wales: stricter coronavirus travel restrictions between Wales and the rest of the UK come into force
,,03/12/2020,"NIE announces easing of restrictions from 11 December (non-essential retail, hospitality)",11/12/2020,"NI: end of lockdown and easing of restrictions (non-essential retail, hospitality)"
,,11/12/2020,Introduction of The Health Protection (Coronavirus) (International Travel and Public Health Information) (Scotland) Regulations 2020,12/12/2020,Scotland: The Health Protection (Coronavirus) (International Travel and Public Health Information) (Scotland) Regulations 2020 come into force (some parts like post-travel isolation time reduction on 14/12/20)
16/12/2020,First Minister Mark Drakeford announces higher level restrictions for Wales (level 4) from Christmas Day ,17/12/2020,NIE announces a third lockdown from 26 December,26/12/2020,"NI: third national lockdown comes into force (initially planned for six weeks, review after four weeks)"
19/12/2020,First Minister Nicola Sturgeon announces the tightening of COVID-19 restrictions around the festive period for Scotland,20/12/2020,Scottish Government announces travel between Scotland and the rest of the UK will not be legal from midnight on Sunday 20 December,25/12/2020,"Scotland: easing of restrictions only on Christmas Day, then all of Scotland back to Level 4"
,,19/12/2020,PM announces new Tier 4 for London and South East England (with stay at home orders),21/12/2020,Tier 4 restrictions come into force 
,,,,26/12/2020,England: more areas enter Tier 4 restrictions 
,,04/01/2021,Four UK CMOs recommend moving COVID-19 alert level from 4 to 5,04/01/2021,UK COVID-19 alert level moved to level 5
,,04/01/2021,PM announces third national lockdown and school closure,05/01/2021,England enters third national lockdown
,,04/01/2021,Nicola Sturgeon announces Scotland will go into full lockdown at midnight,05/01/2021,Scotland enters third national lockdown
,,05/01/2021,NIE announces 'stay at home' order will become law from 8 January,08/01/2021,NI: 'stay at home' order comes into force
,,13/01/2021,Scottish Government announces strengthening of lockdown restrictions (changes in five key areas),16/01/2021,Scotland: further restrictions come into force
,,15/01/2021,Scottish Government announces the suspension of all travel corridors,18/01/2021,Scotland: suspension of all travel corridors
,,19/01/2021,Scottish Government announces that Barra and Vatersay will move into lockdown ,20/01/2021,Scotland: Barra and Vatersay lockdown comes into effect
,,,,21/01/2021,NI: lockdown extended until 5 March
,,05/02/2021,UK Government announces mandatory hotel quarantine will be introduced for anyone travelling from UK’s travel ban list,15/02/2021,Mandatory hotel quarantine for anyone travelling from UK’s travel ban list begins
,,,,18/02/2021,NI: lockdown extended until 1 April
22/02/2021,PM announces four-step roadmap to cautiously ease lockdown restrictions in England,22/02/2021,Government publishes the ‘COVID-19 Response - Spring 2021’ for England,08/03/2021,England: return of schools
24/02/2021,First Minister Nicola Sturgeon announces the planned route out of lockdown for Scotland,09/03/2021,Scottish Government announces changes to level 4 restrictions,12/03/2021,Scotland: changes to level 4 restrictions (meeting outdoors for social and recreational purposes)
02/03/2021,NIE announces exit strategy from lockdown with timetable for lifting measures,16/03/2021,"First Minister Arlene Foster announces easing of lockdown restrictions (social gatherings, schools, sports)",,
,,12/03/2021,First Minister Mark Drakeford announces replacing stay-at-home restrictions with a new interim stay local rule in Wales,13/03/2021,Wales: interim stay local rule comes into force
,,12/03/2021,Health Minister for Wales announces changes to shielding advice from 1 April,,
,,,,15/03/2021,Wales: hairdressers can reopen by appointment only
20/03/2021,"Dr Mike Tildesley, a government scientific adviser, says that summer holidays overseas are ""extremely unlikely"" (risk of COVID variants)",,,,
21/03/2021,PHE Head of immunisation suggests measures like face coverings and socially distancing might be in place for several years until other countries have successfully vaccinated their populations,,,,